{
  "id": "gcloud-iam-management",
  "stackId": "gcloud",
  "name": "IAM Roles and Service Accounts",
  "description": "Create service accounts, assign IAM roles, and manage permissions for secure access to GCP resources.",
  "difficulty": "intermediate",
  "timeMinutes": 10,
  "trending": true,
  "trendingReason": "Least-privilege IAM is critical as organizations tighten cloud security postures.",
  "tags": ["iam", "security", "service-accounts", "rbac", "permissions"],
  "prerequisites": ["gcloud CLI installed", "Project Owner or IAM Admin role"],
  "steps": [
    {
      "title": "Create a service account",
      "command": "gcloud iam service-accounts create myapp-sa --display-name \"My App Service Account\" --description \"Service account for myapp\"",
      "description": "Creates a service account that applications use to authenticate to GCP APIs."
    },
    {
      "title": "Grant a role to the service account",
      "command": "gcloud projects add-iam-policy-binding my-project-id --member \"serviceAccount:myapp-sa@my-project-id.iam.gserviceaccount.com\" --role \"roles/storage.objectViewer\"",
      "description": "Assigns the Storage Object Viewer role, granting read-only access to Cloud Storage objects.",
      "tip": "Follow the principle of least privilege. Grant the narrowest role that meets the requirement."
    },
    {
      "title": "Create and download a key file",
      "command": "gcloud iam service-accounts keys create key.json --iam-account myapp-sa@my-project-id.iam.gserviceaccount.com",
      "description": "Generates a JSON key file for authenticating as the service account.",
      "warning": "Key files are long-lived credentials. Prefer Workload Identity Federation for production. Never commit key files to version control."
    },
    {
      "title": "List IAM policy bindings",
      "command": "gcloud projects get-iam-policy my-project-id --flatten=\"bindings[].members\" --format=\"table(bindings.role, bindings.members)\"",
      "description": "Displays all role bindings in the project in a readable table."
    },
    {
      "title": "Revoke a role",
      "command": "gcloud projects remove-iam-policy-binding my-project-id --member \"serviceAccount:myapp-sa@my-project-id.iam.gserviceaccount.com\" --role \"roles/storage.objectViewer\"",
      "description": "Removes the specified role from the service account."
    }
  ],
  "fullScript": "# IAM roles and service accounts\ngcloud iam service-accounts create myapp-sa --display-name \"My App Service Account\" --description \"Service account for myapp\"\ngcloud projects add-iam-policy-binding my-project-id --member \"serviceAccount:myapp-sa@my-project-id.iam.gserviceaccount.com\" --role \"roles/storage.objectViewer\"\ngcloud iam service-accounts keys create key.json --iam-account myapp-sa@my-project-id.iam.gserviceaccount.com\ngcloud projects get-iam-policy my-project-id --flatten=\"bindings[].members\" --format=\"table(bindings.role, bindings.members)\"\ngcloud projects remove-iam-policy-binding my-project-id --member \"serviceAccount:myapp-sa@my-project-id.iam.gserviceaccount.com\" --role \"roles/storage.objectViewer\"",
  "faq": [
    {
      "question": "What is Workload Identity Federation?",
      "answer": "Workload Identity Federation lets external workloads (e.g., GitHub Actions, AWS) authenticate to GCP without service account keys by exchanging external tokens for short-lived GCP credentials."
    },
    {
      "question": "How do I find which roles a service account has?",
      "answer": "Use 'gcloud asset search-all-iam-policies --query=\"policy:myapp-sa@my-project-id.iam.gserviceaccount.com\"' to find all IAM bindings across the project."
    },
    {
      "question": "What is the difference between basic and predefined roles?",
      "answer": "Basic roles (Owner, Editor, Viewer) are broad and grant wide access. Predefined roles like 'roles/storage.objectViewer' are fine-grained and follow least-privilege principles."
    }
  ],
  "relatedRecipes": ["gcloud-cloud-run-deploy", "gcloud-logging-monitoring"],
  "lastUpdated": "2026-03-11"
}
